id	corpus	emotion	domain
28	Occasionally melodramatic , it 's also extremely effective .	joy	moviereview
62	Singer/composer Bryan Adams contributes a slew of songs -- a few potential hits , a few more simply intrusive to the story -- but the whole package certainly captures the intended , er , spirit of the piece .	joy	moviereview
129	Digital-video documentary about stand-up comedians is a great glimpse into a very different world .	joy	moviereview
131	An enthralling , playful film that constantly frustrates our desire to know the ` truth ' about this man , while deconstructing the very format of the biography in a manner that Derrida would doubtless give his blessing to .	joy	moviereview
147	It 's a great deal of sizzle and very little steak .	disgust	moviereview
183	Remains a solid , if somewhat heavy-handed , account of the near-disaster ... done up by Howard with a steady , if not very imaginative , hand .	noemotion	moviereview
193	It 's traditional moviemaking all the way , but it 's done with a lot of careful period attention as well as some very welcome wit .	joy	moviereview
197	A very funny movie .	joy	moviereview
205	Children may not understand everything that happens -- I 'm not sure even Miyazaki himself does -- but they will almost certainly be fascinated , and undoubtedly delighted .	joy	moviereview
213	She must have a very strong back .	surprise	moviereview
235	Daring , mesmerizing and exceedingly hard to forget .	joy	moviereview
261	Moore 's complex and important film is also , believe it or not , immensely entertaining , a David and Goliath story that 's still very much playing itself out .	surprise	moviereview
293	Parker holds true to Wilde 's own vision of a pure comedy with absolutely no meaning , and no desire to be anything but a polished , sophisticated entertainment that is in love with its own cleverness .	joy	moviereview
332	But based on CQ , I 'll certainly be keeping an eye out for his next project .	anticipation	moviereview
347	While this film is not in the least surprising , it is still ultimately very satisfying .	joy	moviereview
406	Although it bangs a very cliched drum at times , this crowd-pleaser 's fresh dialogue , energetic music , and good-natured spunk are often infectious .	joy	moviereview
419	A very witty take on change , risk and romance , and the film uses humour to make its points about acceptance and growth .	joy	moviereview
432	Kaufman creates an eerie sense of not only being there at the time of these events but the very night Matthew was killed .	sadness	moviereview
443	Starts off with a bang , but then fizzles like a wet stick of dynamite at the very end .	disgust	moviereview
501	Fisher has bared his soul and confronted his own shortcomings here in a way ... that feels very human and very true to life .	joy	moviereview
514	Although very much like the first movie based on J.K. Rowling 's phenomenal fantasy best sellers , this second go-round possesses a quite pleasing , headlong thrust and a likably delinquent attitude .	joy	moviereview
534	This is a very fine movie -- go see it .	joy	moviereview
639	an exceedingly clever piece of cinema .	joy	moviereview
644	very solid , very watchable first feature for director Peter Sheridan	joy	moviereview
676	-LRB- A -RRB- Hollywood sheen bedevils the film from the very beginning ... -LRB- but -RRB- Lohman 's moist , deeply emotional eyes shine through this bogus veneer ...	disgust	moviereview
702	A very funny look at how another culture handles the process of courting and marriage .	joy	moviereview
705	Their computer-animated faces are very expressive .	joy	moviereview
711	Sam Jones became a very lucky filmmaker the day Wilco got dropped from their record label , proving that one man 's ruin may be another 's fortune .	surprise	moviereview
737	Makes S&M seem very romantic , and Maggie Gyllenhaal is a delight .	joy	moviereview
739	Although Life or Something Like It is very much in the mold of feel-good movies , the cast and director Stephen Herek 's polished direction pour delightfully piquant wine from aged bottles .	joy	moviereview
813	Though the film 's scenario is certainly not earthshaking , this depiction of fluctuating female sexuality has two winning lead performances and charm to spare .	joy	moviereview
862	The movie is well shot and very tragic , and one to ponder after the credits roll .	sadness	moviereview
870	The film is all a little Lit Crit 101 , but it 's extremely well played and often very funny .	joy	moviereview
873	It 's absolutely spooky how Lillard channels the Shagster right down to the original Casey Kasem-furnished voice .	fear	moviereview
887	Occasionally funny , always very colorful and enjoyably overblown in the traditional Almod var style .	joy	moviereview
899	A worthy entry into a very difficult genre .	joy	moviereview
1046	Cedar takes a very open-minded approach to this sensitive material , showing impressive control , both visually and in the writing .	joy	moviereview
1084	If the ' 70 's were your idea of a good time at the movies , this will make you very happy .	joy	moviereview
1138	... an otherwise intense , twist-and-turn thriller that certainly should n't hurt talented young Gaghan 's resume .	joy	moviereview
1158	-LRB- T -RRB- his beguiling Belgian fable , very much its own droll and delicate little film , has some touching things to say about what is important in life and why .	joy	moviereview
1218	The very definition of the ` small ' movie , but it is a good stepping stone for director Sprecher .	joy	moviereview
1256	If your taste runs to ` difficult ' films you absolutely ca n't miss it .	joy	moviereview
1264	On this tricky topic , Tadpole is very much a step in the right direction , with its blend of frankness , civility and compassion .	joy	moviereview
1335	Huppert 's superbly controlled display of murderous vulnerability ensures that malice has a very human face .	joy	moviereview
1356	Good film , but very glum .	sadness	moviereview
1408	Overall very good for what it 's trying to do .	joy	moviereview
1444	Mr. Tsai is a very original artist in his medium , and What Time Is It There ?	joy	moviereview
1445	should be seen at the very least for its spasms of absurdist humor .	joy	moviereview
1449	The characters are interesting and often very creatively constructed from figure to backstory .	joy	moviereview
1455	MacDowell , whose wifty Southern charm has anchored lighter affairs ... brings an absolutely riveting conviction to her role .	joy	moviereview
1637	A very well-made , funny and entertaining picture .	joy	moviereview
1729	While not for every taste , this often very funny collegiate gross-out comedy goes a long way toward restoring the luster of the National Lampoon film franchise , too long reduced to direct-to-video irrelevancy .	joy	moviereview
1748	Miller tells this very compelling tale with little fuss or noise , expertly plucking tension from quiet .	joy	moviereview
1759	... very funny , very enjoyable ...	joy	moviereview
1862	A very funny romantic comedy about two skittish New York middle-agers who stumble into a relationship and then struggle furiously with their fears and foibles .	joy	moviereview
1933	Antwone Fisher certainly does the trick of making us care about its protagonist and celebrate his victories but , with few exceptions , it rarely stoops to cheap manipulation or corny conventions to do it .	joy	moviereview
1976	Simultaneously heart-breaking and very funny , The Last Kiss is really all about performances .	joy	moviereview
2059	The hard-to-predict and absolutely essential chemistry between the down-to-earth Bullock and the nonchalant Grant proves to be sensational , and everything meshes in this elegant entertainment .	joy	moviereview
2073	As literary desecrations go , this makes for perfectly acceptable , occasionally very enjoyable children 's entertainment .	joy	moviereview
2089	is one of this year 's very best pictures .	joy	moviereview
2139	Though it 's not very well shot or composed or edited , the score is too insistent and the dialogue is frequently overwrought and crudely literal , the film shatters you in waves .	disgust	moviereview
2141	Yakusho , as always , is wonderful as the long-faced sad sack ... and his chemistry with Shimizu is very believable .	joy	moviereview
2181	On that score , the film certainly does n't disappoint .	joy	moviereview
2186	A macabre and very stylized Swedish fillm about a modern city where all the religious and civic virtues that hold society in place are in tatters .	disgust	moviereview
2219	Rock solid family fun out of the gates , extremely imaginative through out , but wanes in the middle	joy	moviereview
2229	A rich tale of our times , very well told with an appropriate minimum of means .	joy	moviereview
2405	A culture-clash comedy that , in addition to being very funny , captures some of the discomfort and embarrassment of being a bumbling American in Europe .	joy	moviereview
2452	If anything , the film is doing something of a public service -- shedding light on a group of extremely talented musicians who might otherwise go unnoticed and underappreciated by music fans .	joy	moviereview
2465	It 'll keep you wide awake and ... very tense .	surprise	moviereview
2510	Very well-written and very well-acted .	joy	moviereview
2553	A photographic marvel of sorts , and it 's certainly an invaluable record of that special fishy community .	joy	moviereview
2651	Though intrepid in exploring an attraction that crosses sexual identity , Ozpetek falls short in showing us Antonia 's true emotions ... But at the very least , His Secret Life will leave you thinking .	joy	moviereview
2655	The otherwise good-naturedness of Mr. Deeds , with its embrace of sheer goofiness and cameos of less - than-likely New York celebrities ... certainly raises the film above anything Sandler 's been attached to before .	joy	moviereview
2687	The year 2002 has conjured up more coming-of-age stories than seem possible , but Take Care of My Cat emerges as the very best of them .	joy	moviereview
2688	Although it does n't always hang together -- violence and whimsy do n't combine easily -- `` Cherish '' certainly is n't dull .	joy	moviereview
2694	Fubar is very funny , but not always in a laugh-out-loud way .	joy	moviereview
2734	If `` Lilo & Stitch '' is n't the most edgy piece of Disney animation to hit the silver screen , then this first film to use a watercolor background since `` Dumbo '' certainly ranks as the most original in years .	joy	moviereview
2741	Talk to Her is so darned assured , we have absolutely no idea who the main characters are until the film is well under way -- and yet it 's hard to stop watching .	joy	moviereview
2744	A low-key labor of love that strikes a very resonant chord .	joy	moviereview
2794	Entirely suspenseful , extremely well-paced and ultimately ... dare I say , entertaining !	joy	moviereview
2798	The re-release of Ron Howard 's Apollo 13 in the IMAX format proves absolutely that really , really , really good things can come in enormous packages .	joy	moviereview
2846	Leaping from one arresting image to another , Songs from the Second Floor has all the enjoyable randomness of a very lively dream and so manages to be compelling , amusing and unsettling at the same time .	joy	moviereview
2854	It shows us a slice of life that 's very different from our own and yet instantly recognizable .	joy	moviereview
2871	Austin Powers for the most part is extremely funny , the first part making up for any flaws that come later .	joy	moviereview
2877	Fast-paced and wonderfully edited , the film is extremely thorough .	joy	moviereview
2893	Overall , it 's a very entertaining , thought-provoking film with a simple message : God is love .	joy	moviereview
2913	The powerful success of Read My Lips with such provocative material shows why , after only three films , director/co-writer Jacques Audiard , though little known in this country , belongs in the very top rank of French filmmakers .	joy	moviereview
2938	An extremely funny , ultimately heartbreaking look at life in contemporary China .	joy	moviereview
2944	In the new release of Cinema Paradiso , the tale has turned from sweet to bittersweet , and when the tears come during that final , beautiful scene , they finally feel absolutely earned .	joy	moviereview
2946	The film is a masterpiece of nuance and characterization , marred only by an inexplicable , utterly distracting blunder at the very end .	joy	moviereview
2999	This starts off with a 1950 's Doris Day feel and it gets very ugly , very fast .	disgust	moviereview
3001	Triumph of Love is a very silly movie , but the silliness has a pedigree .	joy	moviereview
3090	Gosling creates a staggeringly compelling character , a young man whose sharp intellect is at the very root of his contradictory , self-hating , self-destructive ways .	sadness	moviereview
3099	One of the very best movies ever made about the life of moviemaking .	joy	moviereview
3147	Much of what we see is horrible but it 's also undeniably exceedingly clever .	noemotion	moviereview
3154	A very capable nailbiter .	anticipation	moviereview
3267	Hailed as a clever exercise in neo-Hitchcockianism , this clever and very satisfying picture is more accurately Chabrolian .	joy	moviereview
3339	The plot of the comeback curlers is n't very interesting actually , but what I like about Men With Brooms and what is kind of special is how the film knows what 's unique and quirky about Canadians .	joy	moviereview
3399	At its best -LRB- and it does have some very funny sequences -RRB- Looking for Leonard reminds you just how comically subversive silence can be .	joy	moviereview
3495	"But this is not a movie about an inhuman monster ; it 's about a very human one ."	joy	moviereview
3504	Best of all is Garcia , who perfectly portrays the desperation of a very insecure man .	joy	moviereview
3526	Mr. Deeds is , as comedy goes , very silly -- and in the best way .	joy	moviereview
3586	A very good film sits in the place where a masterpiece should be .	joy	moviereview
3600	It 's very Beavis and Butthead , yet always seems to elicit a chuckle .	joy	moviereview
3632	It 's fairly solid -- not to mention well edited so that it certainly does n't feel like a film that strays past the two and a half mark .	joy	moviereview
3655	The film is a very good viewing alternative for young women .	joy	moviereview
3737	A flawed film but an admirable one that tries to immerse us in a world of artistic abandon and political madness and very nearly succeeds .	other	moviereview
3744	A meatier deeper beginning and/or ending would have easily tipped this film into the `` A '' range , as is , it 's a very very strong `` B + . ''	noemotion	moviereview
3815	Turturro is fabulously funny and over the top as a ` very sneaky ' butler who excels in the art of impossible disappearing/reappearing acts	joy	moviereview
3820	Provides a very moving and revelatory footnote to the Holocaust .	joy	moviereview
3875	What bubbles up out of John C. Walsh 's Pipe Dream is the distinct and very welcome sense of watching intelligent people making a movie they might actually want to watch .	joy	moviereview
3889	A strong first act and absolutely , inescapably gorgeous , skyscraper-trapeze motion of the amazing Spider-Man .	joy	moviereview
3943	A psychic journey deep into the very fabric of Iranian ... life .	noemotion	moviereview
3974	Sensual , funny and , in the end , very touching .	joy	moviereview
4005	Tres Greek writer and star Nia Vardalos has crafted here a worldly-wise and very funny script .	joy	moviereview
4033	This is a very funny , heartwarming film .	joy	moviereview
4040	Often messy and frustrating , but very pleasing at its best moments , it 's very much like life itself .	joy	moviereview
4050	A very well-meaning movie , and it will stand in future years as an eloquent memorial to the World Trade Center tragedy .	joy	moviereview
4072	Death to Smoochy is often very funny , but what 's even more remarkable is the integrity of DeVito 's misanthropic vision .	joy	moviereview
4100	There 's very little sense to what 's going on here , but the makers serve up the cliches with considerable dash .	joy	moviereview
4114	Sillier , cuter , and shorter than the first -LRB- as best I remember -RRB- , but still a very good time at the cinema .	joy	moviereview
4157	The movie is ... very funny as you peek at it through the fingers in front of your eyes .	joy	moviereview
4261	Escapes the precious trappings of most romantic comedies , infusing into the story very real , complicated emotions .	joy	moviereview
4278	There is a welcome lack of pretension about the film , which very simply sets out to entertain and ends up delivering in good measure .	joy	moviereview
4305	An intelligent romantic thriller of a very old-school kind of quality .	joy	moviereview
4346	This film is so different from The Apple and so striking that it can only encourage us to see Samira Makhmalbaf as a very distinctive sensibility , working to develop her own film language with conspicuous success .	joy	moviereview
4347	Like a less dizzily gorgeous companion to Mr. Wong 's In the Mood for Love -- very much a Hong Kong movie despite its mainland setting .	joy	moviereview
4365	A very charming and funny movie .	joy	moviereview
4400	One of those exceedingly rare films in which the talk alone is enough to keep us involved .	joy	moviereview
4407	A stylish but steady , and ultimately very satisfying , piece of character-driven storytelling .	joy	moviereview
4452	An intelligently made -LRB- and beautifully edited -RRB- picture that at the very least has a spark of life to it -- more than you can say for plenty of movies that flow through the Hollywood pipeline without a hitch .	joy	moviereview
4494	Lovely and Amazing is Holofcener 's deep , uncompromising curtsy to women she knows , and very likely is .	joy	moviereview
4542	So beautifully acted and directed , it 's clear that Washington most certainly has a new career ahead of him if he so chooses .	joy	moviereview
4547	A mischievous visual style and oodles of charm make ` Cherish ' a very good -LRB- but not great -RRB- movie .	joy	moviereview
4553	Made for teens and reviewed as such , this is recommended only for those under 20 years of age ... and then only as a very mild rental .	noemotion	moviereview
4576	A chance to see three splendid actors turn a larky chase movie into an emotionally satisfying exploration of the very human need to be somebody , and to belong to somebody .	joy	moviereview
4594	World Traveler might not go anywhere new , or arrive anyplace special , but it 's certainly an honest attempt to get at something .	joy	moviereview
4596	There 's absolutely no reason why Blue Crush , a late-summer surfer girl entry , should be as entertaining as it is	joy	moviereview
4616	Visually breathtaking , viscerally exciting , and dramatically moving , it 's the very definition of epic adventure .	joy	moviereview
4672	If it 's not entirely memorable , the movie is certainly easy to watch .	joy	moviereview
4704	Overall , interesting as a documentary -- but not very Imaxy .	joy	moviereview
4709	Not only is it a charming , funny and beautifully crafted import , it uses very little dialogue , making it relatively effortless to read and follow the action at the same time .	joy	moviereview
4731	... works on some levels and is certainly worth seeing at least once .	joy	moviereview
4754	She 's as rude and profane as ever , always hilarious and , most of the time , absolutely right in her stinging social observations .	joy	moviereview
4759	Will certainly appeal to Asian cult cinema fans and Asiaphiles interested to see what all the fuss is about .	anticipation	moviereview
4770	A very pretty after-school special .	joy	moviereview
4774	It certainly wo n't win any awards in the plot department but it sets out with no pretensions and delivers big time .	joy	moviereview
4803	The color sense of Stuart Little 2 is its most immediate and most obvious pleasure , but it would count for very little if the movie were n't as beautifully shaped and as delicately calibrated in tone as it is .	joy	moviereview
4839	What one is left with , even after the most awful acts are committed , is an overwhelming sadness that feels as if it has made its way into your very bloodstream .	sadness	moviereview
4847	As each of them searches for their place in the world , Miller digs into their very minds to find an unblinking , flawed humanity .	joy	moviereview
4876	It 's ... worth the extra effort to see an artist , still committed to growth in his ninth decade , change while remaining true to his principles with a film whose very subject is , quite pointedly , about the peril of such efforts .	joy	moviereview
4882	This is a very ambitious project for a fairly inexperienced filmmaker , but good actors , good poetry and good music help sustain it .	joy	moviereview
4913	The byplay and bickering between the now spy-savvy siblings , Carmen -LRB- Vega -RRB- and Juni -LRB- Sabara -RRB- Cortez , anchor the film in a very real and amusing give-and-take .	joy	moviereview
4931	Not to mention absolutely refreshed .	joy	moviereview
4939	If the very concept makes you nervous ... you 'll have an idea of the film 's creepy , scary effectiveness .	fear	moviereview
5047	Try as you might to scrutinize the ethics of Kaufman 's approach , somehow it all comes together to create a very compelling , sensitive , intelligent and almost cohesive piece of film entertainment .	joy	moviereview
5059	Grant is certainly amusing , but the very hollowness of the character he plays keeps him at arms length	disgust	moviereview
5163	Williams absolutely nails Sy 's queasy infatuation and overall strangeness .	joy	moviereview
5245	The Wild Thornberrys Movie is pleasant enough and the message of our close ties with animals can certainly not be emphasized enough .	joy	moviereview
5299	However , it 's pleasant enough and its ecological , pro-wildlife sentiments are certainly welcome .	joy	moviereview
5317	Shiner can certainly go the distance , but is n't world championship material	noemotion	moviereview
5399	... certainly an entertaining ride , despite many talky , slow scenes .	joy	moviereview
5519	By turns very dark and very funny .	joy	moviereview
5570	Spinning a web of dazzling entertainment may be overstating it , but `` Spider-Man '' certainly delivers the goods .	joy	moviereview
5578	Fairy-tale formula , serves as a paper skeleton for some very good acting , dialogue , comedy , direction and especially charm .	joy	moviereview
5600	Maggie Smith as the Ya-Ya member with the O2-tank will absolutely crack you up with her crass , then gasp for gas , verbal deportment .	joy	moviereview
5602	Although I did n't hate this one , it 's not very good either .	disgust	moviereview
5606	It 's a very valuable film ...	joy	moviereview
5644	With its jerky hand-held camera and documentary feel , Bloody Sunday is a sobering recount of a very bleak day in Derry .	joy	moviereview
5681	Standing in the Shadows of Motown is the best kind of documentary , one that makes a depleted yesterday feel very much like a brand-new tomorrow .	joy	moviereview
5706	On its own , it 's not very interesting .	disgust	moviereview
5768	Takes one character we do n't like and another we do n't believe , and puts them into a battle of wills that is impossible to care about and is n't very funny .	disgust	moviereview
5781	A portrait of alienation so perfect , it will certainly succeed in alienating most viewers .	disgust	moviereview
5787	Dull and mechanical , kinda like a very goofy museum exhibit	disgust	moviereview
5828	An erotic thriller that 's neither too erotic nor very thrilling , either .	disgust	moviereview
5891	The dialogue is very choppy and monosyllabic despite the fact that it is being dubbed .	disgust	moviereview
5942	Sometimes there are very , very good reasons for certain movies to be sealed in a jar and left on a remote shelf indefinitely .	disgust	moviereview
5948	Unfortunately , it 's also not very good .	disgust	moviereview
5967	Indeed , none of these words really gets at the very special type of badness that is Deuces Wild .	disgust	moviereview
5998	It 's sincere to a fault , but , unfortunately , not very compelling or much fun .	disgust	moviereview
6013	It wo n't harm anyone , but neither can I think of a very good reason to rush right out and see it .	disgust	moviereview
6031	Every now and again , a movie comes along to remind us of how very bad a motion picture can truly be .	disgust	moviereview
6045	It 's a very tasteful rock and roll movie .	joy	moviereview
6074	An extremely unpleasant film .	disgust	moviereview
6089	Stale first act , Scrooge story , blatant product placement , some very good comedic songs , strong finish , dumb fart jokes .	disgust	moviereview
6157	... while certainly clever in spots , this too-long , spoofy update of Shakespeare 's Macbeth does n't sustain a high enough level of invention .	disgust	moviereview
6173	None of this is very original , and it is n't particularly funny .	disgust	moviereview
6238	In the name of an allegedly inspiring and easily marketable flick , The Emperor 's Club turns a blind eye to the very history it pretends to teach .	disgust	moviereview
6273	"A few pieces of the film buzz and whir ; very little of it actually clicks ."	disgust	moviereview
6275	... contains very few laughs and even less surprises .	disgust	moviereview
6444	Whatever satire Lucky Break was aiming for , it certainly got lost in the `` soon-to-be-forgettable '' section of the quirky rip-off prison romp pile .	disgust	moviereview
6482	It 's just not very smart .	disgust	moviereview
6504	The film itself is about something very interesting and odd that would probably work better as a real documentary without the insinuation of mediocre acting or a fairly trite narrative .	disgust	moviereview
6560	This overproduced piece of dreck is shockingly bad and absolutely unnecessary .	disgust	moviereview
