id	corpus	emotion	domain
14619	However, for me, the more artistic exhibits were more of a turn off - I willingly admit that I was very attached to my cadaver in Gross, and the thought of him being displayed like that makes me a bit sick.	disgust	blog
14659	I did not climb very high up but was not bad either.	noemotion	blog
14704	UNCLEAN! should at the very least be a public restroom on the interstate.	disgust	blog
14709	But it was nice to get out to the movies with Holly, I don't get to see her very much at all in any role other than as mom, and as a single male with no kids, it's hard to associate myself with parents.	joy	blog
14724	I don't find the idea of poking around in the dark deep in the bowels of the earth very entertaining at all, I don't think our ancestors, devoid of electric flashlights and safety equipment would be any more inclined to risking their life for so worthless an enterprise.	disgust	blog
14726	If this took place in the wilds of Africa, perhaps it might be worth venturing into the earth to escape the large predators that prayed upon human beings so very long ago, but even that was well before we took to cave drawing.	noemotion	blog
14785	Ahsan told me that he remembers the collision mostly because the game was being played in the rain and we very rarely play when it's raining.	noemotion	blog
14829	I am looking to drive more so I can get my G2, I am solid in my belief that I am going to Brantford on the 26th, I am no longer indecisive, I want to get away from the issue between my parents, and I am looking to be very assertive for college.	anticipation	blog
14864	i dont like myself    quite frankly i dislike myself very much, dont ask why cause i couldnt tell you.	sadness	blog
14872	Perhaps I am just being petty, but that did really annoy me.  It absolutely outrages me as to how evil, and canniving these people are.	disgust	blog
15003	so the nurse was doing suction, and she accidently hit the rubber sheath across my mouth isolating the tooth which made a very loud noise in my ear, so I flinched, and the dentist was like It's not big deal, show her it's nothing to be afraid of so she did it again and I really freaked out, really flinched and even cried out and then I starting crying.	surprise	blog
15015	she's living at home with her parents now and she's not feeling very good about herself.	sadness	blog
15060	I even suggest that the government has always wished us to be afraid of communism, because it goes against the very thing that government relies upon to keep it rolling: capitalism.	noemotion	blog
15070	The very act of revolution demands a will stronger than Dancing With The Stars, Cribs and the latest incarnation of CSI.	noemotion	blog
15113	"I see this commercial every morning; it is an omen for a very bad day."	disgust	blog
15457	The hijab is accepted and tolerated, as are the nikab wearers which is an extremely small percentage of Muslim women.	noemotion	blog
15965	its a very expensive german hofner model, brand new.	noemotion	blog
15966	that and le cygne, which is also very easy but just as sophisticated as anything else.	noemotion	blog
15998	It hasn't been very eventful in any way.	noemotion	blog
16640	I start my very last class Monday.	noemotion	blog
16943	She is also very strong and keen, but carries the scars of her past.	joy	blog
16955	I do miss them so very much, though I don't miss class at all.	sadness	blog
16981	I love the song Absolutely Everybody ever since the parade.	joy	blog
17051	It's pretty sweet and I feel very blessed that I have it.	joy	blog
